{"schema_version":"phase2k-full-transcript-ablation-intermediate-response-v1","case_id":"p2k:case:0004","condition":"A","payload_sha256":"ffe689b5a3d383800d25af436f9cbe2261fd0d37e54fe5819c525768ebe12fd6","instructions_sha256":"b91a51d44b72bf48334a7def4f9b2b7fc545bb1dba39ca75214ff38035efa5be","fields":{"actors_entities":[{"extraction_text":"Briar (surface form \"Brier\", repaired via supplied champion alias rule Brier->Briar); ally whose win/loss is discussed","resolution_status":"vocabulary_supported","source_references":[{"quote":"if Brier doesn't win one one","occurrence_index":0},{"quote":"just because Brier loses to","occurrence_index":0}]},{"extraction_text":"Taliyah (surface form \"Talia\", repaired via supplied champion alias rule Talia->Taliyah)","resolution_status":"vocabulary_supported","source_references":[{"quote":"I hope Talia does not 2v one you","occurrence_index":0}]},{"extraction_text":"The coached player (addressee \"you\"), the top-lane player per session metadata","resolution_status":"context_resolved","source_references":[{"quote":"you should go","occurrence_index":0},{"quote":"you shouldn't invade","occurrence_index":0}]},{"extraction_text":"The coach (speaker, self-reference \"I\")","resolution_status":"context_resolved","source_references":[{"quote":"I hope Talia does not 2v one you","occurrence_index":0}]}],"reference_bindings":[{"extraction_text":"Second-person \"you\" throughout the passage binds to the coached player (student)","resolution_status":"context_resolved","source_references":[{"quote":"you should go","occurrence_index":0},{"quote":"you still want to invade","occurrence_index":0}]},{"extraction_text":"First-person \"I\" binds to the coach (speaker)","resolution_status":"context_resolved","source_references":[{"quote":"I hope Talia does not 2v one you","occurrence_index":0}]},{"extraction_text":"\"it\" in \"you could make it winning\" has no antecedent resolvable from the supplied material; left unresolved","resolution_status":"unresolved","source_references":[{"quote":"make it winning","occurrence_index":0}]}],"abilities_resources":[],"events_actions":[],"states":[],"conditions":[{"extraction_text":"Conditional: if Brier (Briar) does not win \"one one\" (likely ASR-corrupted phrase, see uncertainty), then you should go","resolution_status":"literal_explicit","source_references":[{"quote":"if Brier doesn't win one one then you should go","occurrence_index":0}]},{"extraction_text":"Concessive condition: even if Brier loses, that fact alone does not mean you shouldn't invade","resolution_status":"literal_explicit","source_references":[{"quote":"just because Brier loses to doesn't mean you shouldn't invade","occurrence_index":0}]}],"recommended_advice":[{"extraction_text":"You should go if Brier doesn't win \"one one\"","resolution_status":"literal_explicit","source_references":[{"quote":"if Brier doesn't win one one then you should go","occurrence_index":0}]},{"extraction_text":"You should still go and invade even if Brier loses, because you still want to invade; Brier's loss does not cancel the invade plan","resolution_status":"literal_explicit","source_references":[{"quote":"then you should go because you still want to invade","occurrence_index":0},{"quote":"doesn't mean you shouldn't invade","occurrence_index":0}]}],"consequences_outcomes":[{"extraction_text":"Invading could make \"it\" (referent unresolved) winning; i.e., invading may produce a winning outcome","resolution_status":"literal_explicit","source_references":[{"quote":"cuz you could make it winning","occurrence_index":0}]},{"extraction_text":"Implied unwanted outcome the coach hopes to avoid: Taliyah 2v1-ing you (\"2v one\" likely ASR corruption of \"2v1\")","resolution_status":"context_resolved","source_references":[{"quote":"I hope Talia does not 2v one you","occurrence_index":0}]}],"explicit_relationships":[{"extraction_text":"'Brier doesn't win one one' is the condition under which 'you should go' holds","relation_type":"CONDITION","resolution_status":"literal_explicit","source_references":[{"quote":"if Brier doesn't win one one then you should go","occurrence_index":0}]},{"extraction_text":"Your invading could cause 'it' (unresolved referent) to become winning","relation_type":"CAUSES","resolution_status":"literal_explicit","source_references":[{"quote":"you still want to invade","occurrence_index":0},{"quote":"cuz you could make it winning","occurrence_index":0}]},{"extraction_text":"Brier losing does not negate the recommendation to invade ('doesn't mean you shouldn't invade')","relation_type":"NEGATES","resolution_status":"literal_explicit","source_references":[{"quote":"just because Brier loses to doesn't mean you shouldn't invade","occurrence_index":0}]}],"uncertainty_unresolved":[{"extraction_text":"\"one one\" after \"win\" appears to be ASR corruption, plausibly \"1v1\", but this cannot be confirmed from the supplied material","resolution_status":"unresolved","source_references":[{"quote":"win one one then","occurrence_index":0}]},{"extraction_text":"Trailing \"to\" in \"Brier loses to\" appears to be ASR corruption (possibly \"too\" or truncation); unrecoverable","resolution_status":"unresolved","source_references":[{"quote":"Brier loses to","occurrence_index":0}]},{"extraction_text":"\"2v one\" appears to be ASR corruption of \"2v1\"; repair not licensed by the supplied vocabulary, left unresolved","resolution_status":"unresolved","source_references":[{"quote":"not 2v one you","occurrence_index":0}]},{"extraction_text":"Referent of \"it\" in \"make it winning\" cannot be resolved from the supplied material","resolution_status":"unresolved","source_references":[{"quote":"make it winning","occurrence_index":0}]},{"extraction_text":"Passage begins mid-sentence at \"move then\"; the destination of the initial 'go' and prior context are unavailable","resolution_status":"unresolved","source_references":[{"quote":"move then you should go","occurrence_index":0}]}],"supporting_source_spans":[{"extraction_text":"Supports the conditional advice that you should go if Brier doesn't win","resolution_status":"literal_explicit","source_references":[{"quote":"if Brier doesn't win one one then you should go","occurrence_index":0}]},{"extraction_text":"Supports the rationale that you still want to invade","resolution_status":"literal_explicit","source_references":[{"quote":"then you should go because you still want to invade","occurrence_index":0}]},{"extraction_text":"Supports that Brier losing does not preclude invading","resolution_status":"literal_explicit","source_references":[{"quote":"just because Brier loses to doesn't mean you shouldn't invade","occurrence_index":0}]},{"extraction_text":"Supports the potential positive outcome of invading","resolution_status":"literal_explicit","source_references":[{"quote":"cuz you could make it winning","occurrence_index":0}]},{"extraction_text":"Supports the coach's stated concern about Taliyah fighting you 2v1","resolution_status":"literal_explicit","source_references":[{"quote":"I hope Talia does not 2v one you","occurrence_index":0}]}]}}
