{"schema_version":"phase2k-full-transcript-ablation-intermediate-response-v1","case_id":"p2k:case:0002","condition":"B","payload_sha256":"545e27ac1f60afe5dbd72fb204133c4c0c77d1e719b5d601ebef7fae0038f235","instructions_sha256":"b91a51d44b72bf48334a7def4f9b2b7fc545bb1dba39ca75214ff38035efa5be","fields":{"actors_entities":[{"extraction_text":"Aatrox (surface: 'atrox')","resolution_status":"vocabulary_supported","source_references":[{"quote":"look at atrox atrox has 11 CS after this","occurrence_index":0}]},{"extraction_text":"Darius (surface: 'darus')","resolution_status":"vocabulary_supported","source_references":[{"quote":"will beat this darus","occurrence_index":0}]},{"extraction_text":"Coach (speaker; surface: 'I')","resolution_status":"context_resolved","source_references":[{"quote":"probably not right because I don't think so","occurrence_index":0}]},{"extraction_text":"Player being coached (addressee; surface: 'you')","resolution_status":"context_resolved","source_references":[{"quote":"do you really think atrox with clo armor full HP will beat this darus","occurrence_index":0}]}],"reference_bindings":[{"extraction_text":"'he' in 'he's giving a freeb' binds to Aatrox","resolution_status":"context_resolved","source_references":[{"quote":"if at he's giving a freeb right","occurrence_index":0}]},{"extraction_text":"'you' in 'do you really think' binds to the player being coached","resolution_status":"context_resolved","source_references":[{"quote":"do you really think atrox with clo armor full HP will beat this darus","occurrence_index":0}]},{"extraction_text":"'I' in 'I don't think so' binds to the coach","resolution_status":"context_resolved","source_references":[{"quote":"probably not right because I don't think so","occurrence_index":0}]},{"extraction_text":"'so' in 'I don't think so' binds to the proposition 'Aatrox with cloth armor and full HP will beat this Darius' (denied by 'don't think')","resolution_status":"context_resolved","source_references":[{"quote":"probably not right because I don't think so","occurrence_index":0}]},{"extraction_text":"'this' in 'after this' is unresolved in the target passage","resolution_status":"unresolved","source_references":[{"quote":"atrox has 11 CS after this","occurrence_index":0}]},{"extraction_text":"'this' in 'because this if yeah' is garbled and unresolved","resolution_status":"unresolved","source_references":[{"quote":"because this if yeah if atrox T is back here","occurrence_index":0}]},{"extraction_text":"'at' in 'if at he's giving' is an unresolved ASR fragment; possibly truncated 'atrox'","resolution_status":"unresolved","source_references":[{"quote":"if at he's giving a freeb right","occurrence_index":0}]},{"extraction_text":"'this' in 'this darus' binds to the current Darius in the game","resolution_status":"context_resolved","source_references":[{"quote":"will beat this darus","occurrence_index":0}]}],"abilities_resources":[{"extraction_text":"Aatrox's Teleport representation (surface 'T'; candidate resolution, not explicit)","resolution_status":"unresolved","source_references":[{"quote":"if atrox T is back here","occurrence_index":0}]},{"extraction_text":"Aatrox's Cloth Armor item candidate (surface 'clo armor'; not exact)","resolution_status":"unresolved","source_references":[{"quote":"do you really think atrox with clo armor full HP will beat this darus","occurrence_index":0}]},{"extraction_text":"Aatrox's creep score: 11 CS","resolution_status":"literal_explicit","source_references":[{"quote":"atrox has 11 CS after this","occurrence_index":0}]}],"events_actions":[{"extraction_text":"Aatrox is giving a 'freeb' (unresolved term; possibly a free base/back)","resolution_status":"unresolved","source_references":[{"quote":"if at he's giving a freeb right","occurrence_index":0}]}],"states":[{"extraction_text":"Aatrox has 11 CS after this","resolution_status":"literal_explicit","source_references":[{"quote":"atrox has 11 CS after this","occurrence_index":0}]},{"extraction_text":"Aatrox is at full HP in the considered scenario","resolution_status":"literal_explicit","source_references":[{"quote":"do you really think atrox with clo armor full HP will beat this darus","occurrence_index":0}]},{"extraction_text":"Aatrox has cloth armor in the considered scenario (surface 'clo armor')","resolution_status":"unresolved","source_references":[{"quote":"do you really think atrox with clo armor full HP will beat this darus","occurrence_index":0}]},{"extraction_text":"Aatrox's T is back here in the considered scenario (likely Teleport availability)","resolution_status":"unresolved","source_references":[{"quote":"if atrox T is back here","occurrence_index":0}]}],"conditions":[{"extraction_text":"If Aatrox is giving a 'freeb' (unresolved term)","resolution_status":"unresolved","source_references":[{"quote":"if at he's giving a freeb right","occurrence_index":0}]},{"extraction_text":"If Aatrox's T is back here","resolution_status":"unresolved","source_references":[{"quote":"if atrox T is back here","occurrence_index":0}]},{"extraction_text":"In the considered scenario where Aatrox has cloth armor and full HP","resolution_status":"literal_explicit","source_references":[{"quote":"do you really think atrox with clo armor full HP will beat this darus","occurrence_index":0}]}],"recommended_advice":[],"consequences_outcomes":[{"extraction_text":"Aatrox with cloth armor and full HP probably will not beat this Darius","resolution_status":"literal_explicit","source_references":[{"quote":"do you really think atrox with clo armor full HP will beat this darus probably not right because I don't think so","occurrence_index":0}]}],"explicit_relationships":[{"extraction_text":"Surface 'atrox' refers to Aatrox","relation_type":"REFERS_TO","resolution_status":"vocabulary_supported","source_references":[{"quote":"look at atrox atrox has 11 CS after this","occurrence_index":0}]},{"extraction_text":"Surface 'darus' refers to Darius","relation_type":"REFERS_TO","resolution_status":"vocabulary_supported","source_references":[{"quote":"will beat this darus","occurrence_index":0}]},{"extraction_text":"Aatrox is the actor of the proposed 'will beat this darus' scenario","relation_type":"ACTOR","resolution_status":"literal_explicit","source_references":[{"quote":"do you really think atrox with clo armor full HP will beat this darus","occurrence_index":0}]},{"extraction_text":"Darius is the target of the proposed 'will beat this darus' scenario","relation_type":"TARGET","resolution_status":"literal_explicit","source_references":[{"quote":"do you really think atrox with clo armor full HP will beat this darus","occurrence_index":0}]}],"uncertainty_unresolved":[{"extraction_text":"'freeb' in 'giving a freeb' is unrecoverable from the source; possibly 'free base' or 'free back'","resolution_status":"unresolved","source_references":[{"quote":"if at he's giving a freeb right","occurrence_index":0}]},{"extraction_text":"Phrase 'if at he's' is ASR-garbled; 'at' cannot be reliably bound","resolution_status":"unresolved","source_references":[{"quote":"if at he's giving a freeb right","occurrence_index":0}]},{"extraction_text":"'T' in 'atrox T is back here' is an unresolved abbreviation; likely Teleport but not expanded in the source","resolution_status":"unresolved","source_references":[{"quote":"if atrox T is back here","occurrence_index":0}]},{"extraction_text":"'clo armor' in 'with clo armor full HP' is uncertain; likely 'cloth armor' but not spelled out","resolution_status":"unresolved","source_references":[{"quote":"do you really think atrox with clo armor full HP will beat this darus","occurrence_index":0}]},{"extraction_text":"Antecedent of 'after this' is unresolved in the target passage","resolution_status":"unresolved","source_references":[{"quote":"atrox has 11 CS after this","occurrence_index":0}]},{"extraction_text":"'because this if yeah if' is garbled; the 'this' and clause structure cannot be reliably restored","resolution_status":"unresolved","source_references":[{"quote":"because this if yeah if atrox T is back here","occurrence_index":0}]}],"supporting_source_spans":[{"extraction_text":"Target passage source span","resolution_status":"literal_explicit","source_references":[{"quote":"look at atrox atrox has 11 CS after this if at he's giving a freeb right because this if yeah if atrox T is back here do you really think atrox with clo armor full HP will beat this darus probably not right because I don't think so","occurrence_index":0}]}]}}