{"schema_version":"phase2k-full-transcript-ablation-intermediate-response-v1","case_id":"p2k:case:0010","condition":"B","payload_sha256":"e2b7c553748c929dbc250ab80671d47d83bf86c3d1722759d85b1f4d973318bb","instructions_sha256":"b91a51d44b72bf48334a7def4f9b2b7fc545bb1dba39ca75214ff38035efa5be","fields":{"actors_entities":[{"extraction_text":"Varus (the coached player's champion; source surface 'vars')","resolution_status":"context_resolved","source_references":[{"quote":"playing a lot of vars","occurrence_index":0}]},{"extraction_text":"you (the coached ADC player)","resolution_status":"context_resolved","source_references":[{"quote":"the one way that you can win is if you do get push","occurrence_index":0}]},{"extraction_text":"bliss crank (Blitzcrank)","resolution_status":"context_resolved","source_references":[{"quote":"bliss crank now with a kalista","occurrence_index":0},{"quote":"blitzcrank misses hook","occurrence_index":0}]},{"extraction_text":"kalista","resolution_status":"literal_explicit","source_references":[{"quote":"with a kalista","occurrence_index":0}]}],"reference_bindings":[{"extraction_text":"you -> the coached player / Varus","resolution_status":"context_resolved","source_references":[{"quote":"the one way that you can win is if you do get push","occurrence_index":0},{"quote":"playing a lot of vars","occurrence_index":0}]},{"extraction_text":"it in 'you could get it' -> push","resolution_status":"context_resolved","source_references":[{"quote":"then you could get it then you could win","occurrence_index":0},{"quote":"if you do get push","occurrence_index":0}]},{"extraction_text":"this in 'you're not meant to win this' -> the Blitzcrank/Kalista matchup","resolution_status":"context_resolved","source_references":[{"quote":"bliss crank now with a kalista","occurrence_index":0},{"quote":"not meant to win this","occurrence_index":0}]}],"abilities_resources":[],"events_actions":[{"extraction_text":"get push (the conditional action recommended in the target)","resolution_status":"literal_explicit","source_references":[{"quote":"if you do get push","occurrence_index":0}]}],"states":[{"extraction_text":"You don't win in this matchup.","resolution_status":"literal_explicit","source_references":[{"quote":"now you don't win but","occurrence_index":0}]},{"extraction_text":"This matchup is not meant to be won.","resolution_status":"literal_explicit","source_references":[{"quote":"not meant to win this","occurrence_index":0}]},{"extraction_text":"Push is the one way that you can win.","resolution_status":"literal_explicit","source_references":[{"quote":"the one way that you can win is if you do get push","occurrence_index":0}]},{"extraction_text":"There may be an angle to get push.","resolution_status":"literal_explicit","source_references":[{"quote":"if there's an angle to get push","occurrence_index":0}]}],"conditions":[{"extraction_text":"If you get push, then you can win.","resolution_status":"literal_explicit","source_references":[{"quote":"the one way that you can win is if you do get push","occurrence_index":0}]},{"extraction_text":"If there is an angle to get push, then you could get it and then you could win.","resolution_status":"literal_explicit","source_references":[{"quote":"if there's an angle to get push then you could get it then you could win","occurrence_index":0}]}],"recommended_advice":[{"extraction_text":"If there is an angle to get push, take it; getting push is the one way you can win.","resolution_status":"literal_explicit","source_references":[{"quote":"the one way that you can win is if you do get push","occurrence_index":0},{"quote":"if there's an angle to get push then you could get it then you could win","occurrence_index":0}]}],"consequences_outcomes":[{"extraction_text":"Getting push can lead to winning.","resolution_status":"literal_explicit","source_references":[{"quote":"the one way that you can win is if you do get push","occurrence_index":0},{"quote":"then you could get it then you could win","occurrence_index":0}]},{"extraction_text":"If you do not get push, you do not win; this matchup is not meant to be won.","resolution_status":"context_resolved","source_references":[{"quote":"now you don't win but","occurrence_index":0},{"quote":"not meant to win this","occurrence_index":0}]}],"explicit_relationships":[{"relation_type":"CONDITION","extraction_text":"Getting push is the condition for winning.","resolution_status":"literal_explicit","source_references":[{"quote":"the one way that you can win is if you do get push","occurrence_index":0}]},{"relation_type":"ENABLES","extraction_text":"An angle to get push enables you to get push, and getting push enables winning.","resolution_status":"literal_explicit","source_references":[{"quote":"if there's an angle to get push then you could get it then you could win","occurrence_index":0}]},{"relation_type":"RESULT","extraction_text":"Getting push can result in winning.","resolution_status":"literal_explicit","source_references":[{"quote":"then you could get it then you could win","occurrence_index":0}]},{"relation_type":"REFERS_TO","extraction_text":"'this' in 'not meant to win this' refers to the Blitzcrank/Kalista matchup.","resolution_status":"context_resolved","source_references":[{"quote":"bliss crank now with a kalista","occurrence_index":0},{"quote":"not meant to win this","occurrence_index":0}]},{"relation_type":"ACTOR","extraction_text":"you (Varus) is the actor who could get push and win.","resolution_status":"context_resolved","source_references":[{"quote":"the one way that you can win is if you do get push","occurrence_index":0},{"quote":"playing a lot of vars","occurrence_index":0}]}],"uncertainty_unresolved":[{"extraction_text":"The span 'MH' after 'then you could win' is an uncorrected/uncertain ASR span; it may be a backchannel or hesitation rather than a recoverable word.","resolution_status":"unresolved","source_references":[{"quote":"MH","occurrence_index":0}]}],"supporting_source_spans":[{"extraction_text":"the one way that you can win is if you do get push","resolution_status":"literal_explicit","source_references":[{"quote":"the one way that you can win is if you do get push","occurrence_index":0}]},{"extraction_text":"if there's an angle to get push then you could get it then you could win","resolution_status":"literal_explicit","source_references":[{"quote":"if there's an angle to get push then you could get it then you could win","occurrence_index":0}]},{"extraction_text":"not meant to win this","resolution_status":"literal_explicit","source_references":[{"quote":"not meant to win this","occurrence_index":0}]},{"extraction_text":"bliss crank now with a kalista","resolution_status":"literal_explicit","source_references":[{"quote":"bliss crank now with a kalista","occurrence_index":0}]},{"extraction_text":"playing a lot of vars","resolution_status":"literal_explicit","source_references":[{"quote":"playing a lot of vars","occurrence_index":0}]},{"extraction_text":"now you don't win but","resolution_status":"literal_explicit","source_references":[{"quote":"now you don't win but","occurrence_index":0}]}]}}