{"schema_version":"phase2k-full-transcript-ablation-intermediate-response-v1","case_id":"p2k:case:0004","condition":"B","payload_sha256":"effd2af1dab440322eb312c3890f185eebb367bfd160599c604d9674fc0c5e79","instructions_sha256":"b91a51d44b72bf48334a7def4f9b2b7fc545bb1dba39ca75214ff38035efa5be","fields":{"actors_entities":[{"extraction_text":"Brier","resolution_status":"vocabulary_supported","source_references":[{"quote":"if Brier doesn't win one one","occurrence_index":0},{"quote":"Brier loses to","occurrence_index":0}]},{"extraction_text":"Talia","resolution_status":"vocabulary_supported","source_references":[{"quote":"I hope Talia does not 2v one you","occurrence_index":0}]},{"extraction_text":"you","resolution_status":"context_resolved","source_references":[{"quote":"move then you should go if Brier doesn't win one one then you should go","occurrence_index":0},{"quote":"I hope Talia does not 2v one you","occurrence_index":0}]},{"extraction_text":"I","resolution_status":"context_resolved","source_references":[{"quote":"I hope Talia does not 2v one you","occurrence_index":0}]}],"reference_bindings":[{"extraction_text":"'you' refers to the coached player (Aatrox top laner)","resolution_status":"context_resolved","source_references":[{"quote":"move then you should go if Brier doesn't win one one then you should go","occurrence_index":0},{"quote":"I hope Talia does not 2v one you","occurrence_index":0}]},{"extraction_text":"'I' refers to the coach/speaker","resolution_status":"context_resolved","source_references":[{"quote":"I hope Talia does not 2v one you","occurrence_index":0}]},{"extraction_text":"'it' in 'make it winning' refers to the invade","resolution_status":"context_resolved","source_references":[{"quote":"cuz you could make it winning","occurrence_index":0}]},{"extraction_text":"'Brier' refers to Briar","resolution_status":"vocabulary_supported","source_references":[{"quote":"if Brier doesn't win one one","occurrence_index":0}]},{"extraction_text":"'Talia' refers to Taliyah","resolution_status":"vocabulary_supported","source_references":[{"quote":"I hope Talia does not 2v one you","occurrence_index":0}]}],"abilities_resources":[],"events_actions":[],"states":[],"conditions":[{"extraction_text":"If the unresolved 'IIA' can move, then you should go.","resolution_status":"unresolved","source_references":[{"quote":"IIA can move then you should go","occurrence_index":0}]},{"extraction_text":"If Brier does not win one one, then you should go.","resolution_status":"literal_explicit","source_references":[{"quote":"if Brier doesn't win one one then you should go","occurrence_index":0}]},{"extraction_text":"Brier losing does not imply you should not invade.","resolution_status":"literal_explicit","source_references":[{"quote":"just because Brier loses to doesn't mean you shouldn't invade","occurrence_index":0}]},{"extraction_text":"You still want to invade because you could make it winning.","resolution_status":"context_resolved","source_references":[{"quote":"because you still want to invade","occurrence_index":0},{"quote":"cuz you could make it winning","occurrence_index":0}]}],"recommended_advice":[{"extraction_text":"You should go.","resolution_status":"literal_explicit","source_references":[{"quote":"move then you should go if Brier doesn't win one one then you should go","occurrence_index":0}]},{"extraction_text":"You should still want to invade.","resolution_status":"literal_explicit","source_references":[{"quote":"because you still want to invade","occurrence_index":0}]},{"extraction_text":"Brier losing does not mean you shouldn't invade; you could make it winning.","resolution_status":"context_resolved","source_references":[{"quote":"just because Brier loses to doesn't mean you shouldn't invade","occurrence_index":0},{"quote":"cuz you could make it winning","occurrence_index":0}]}],"consequences_outcomes":[{"extraction_text":"You could make it winning.","resolution_status":"context_resolved","source_references":[{"quote":"cuz you could make it winning","occurrence_index":0}]},{"extraction_text":"Brier losing is not a sufficient reason to abandon the invade.","resolution_status":"literal_explicit","source_references":[{"quote":"just because Brier loses to doesn't mean you shouldn't invade","occurrence_index":0}]},{"extraction_text":"If Brier does not win one one and you go, you could make it winning.","resolution_status":"context_resolved","source_references":[{"quote":"if Brier doesn't win one one then you should go","occurrence_index":0},{"quote":"cuz you could make it winning","occurrence_index":0}]}],"explicit_relationships":[{"relation_type":"CONDITION","extraction_text":"The unresolved 'IIA' moving is a condition for 'you should go' in the adjacent source context.","resolution_status":"unresolved","source_references":[{"quote":"IIA can move then you should go","occurrence_index":0}]},{"relation_type":"CONDITION","extraction_text":"Brier not winning one one is a condition for your going.","resolution_status":"literal_explicit","source_references":[{"quote":"if Brier doesn't win one one then you should go","occurrence_index":0}]},{"relation_type":"NEGATES","extraction_text":"Brier losing does not negate invading; it does not mean 'you shouldn't invade'.","resolution_status":"literal_explicit","source_references":[{"quote":"just because Brier loses to doesn't mean you shouldn't invade","occurrence_index":0}]},{"relation_type":"CAUSES","extraction_text":"Wanting to invade is because you could make it winning.","resolution_status":"context_resolved","source_references":[{"quote":"because you still want to invade","occurrence_index":0},{"quote":"cuz you could make it winning","occurrence_index":0}]},{"relation_type":"REFERS_TO","extraction_text":"'it' in 'make it winning' refers to the invade.","resolution_status":"context_resolved","source_references":[{"quote":"cuz you could make it winning","occurrence_index":0}]},{"relation_type":"ACTOR","extraction_text":"Talia is the actor in the '2v one' on you that the coach hopes does not happen.","resolution_status":"literal_explicit","source_references":[{"quote":"I hope Talia does not 2v one you","occurrence_index":0}]},{"relation_type":"TARGET","extraction_text":"You are the target of the '2v one' by Talia that the coach hopes does not happen.","resolution_status":"literal_explicit","source_references":[{"quote":"I hope Talia does not 2v one you","occurrence_index":0}]}],"uncertainty_unresolved":[{"extraction_text":"The token 'IIA' immediately before the target's opening 'move' is unresolved; context suggests 'Talia', but that is a possible repair, not a confirmed reading.","resolution_status":"unresolved","source_references":[{"quote":"IIA can move then you should go","occurrence_index":0}]},{"extraction_text":"The object of 'Brier loses to' is omitted; context suggests Taliyah, but the source does not explicitly name the object.","resolution_status":"unresolved","source_references":[{"quote":"Brier loses to","occurrence_index":0}]},{"extraction_text":"The target passage's opening word 'move' lacks an explicit subject if read in isolation; only the adjacent context supplies 'IIA can move'.","resolution_status":"unresolved","source_references":[{"quote":"move then you should go","occurrence_index":0},{"quote":"IIA can move then you should go","occurrence_index":0}]}],"supporting_source_spans":[{"extraction_text":"target passage span","resolution_status":"literal_explicit","source_references":[{"quote":"move then you should go if Brier doesn't win one one then you should go because you still want to invade just because Brier loses to doesn't mean you shouldn't invade cuz you could make it winning right I hope Talia does not 2v one you right but","occurrence_index":0}]},{"extraction_text":"preceding context resolving the opening 'move' clause","resolution_status":"unresolved","source_references":[{"quote":"IIA can move then you should go","occurrence_index":0}]},{"extraction_text":"broader preceding context for 'you should go'","resolution_status":"context_resolved","source_references":[{"quote":"your job to back up Brier if she needs the backup okay let's say IIA can move then you should go","occurrence_index":0}]}]}}