{"schema_version":"phase2k-full-transcript-ablation-intermediate-response-v1","case_id":"p2k:case:0009","condition":"B","payload_sha256":"339ee522f1ade08695cfaff6718623551b618d76e04f2fab319787ad675fa84e","instructions_sha256":"b91a51d44b72bf48334a7def4f9b2b7fc545bb1dba39ca75214ff38035efa5be","fields":{"actors_entities":[{"extraction_text":"Mel","resolution_status":"literal_explicit","source_references":[{"quote":"If Mel is showing on mid, this could be a good flip,","occurrence_index":0}]},{"extraction_text":"Poppy","resolution_status":"literal_explicit","source_references":[{"quote":"She's not a bot, because well, obviously, she's not killing Poppy.","occurrence_index":0}]},{"extraction_text":"the addressed player ('you')","resolution_status":"context_resolved","source_references":[{"quote":"But you don't play around waves being your ward. So, you chase.","occurrence_index":0}]},{"extraction_text":"minion waves (used as a ward/vision source)","resolution_status":"context_resolved","source_references":[{"quote":"wave equals ward","occurrence_index":0},{"quote":"waves being your ward","occurrence_index":0}]}],"reference_bindings":[{"extraction_text":"'it' in 'then it's bot' refers to the third possible location/option, bot lane.","resolution_status":"context_resolved","source_references":[{"quote":"then it's bot.","occurrence_index":0}]},{"extraction_text":"'She' in 'She's not a bot' refers to Mel.","resolution_status":"context_resolved","source_references":[{"quote":"She's not a bot, because well, obviously, she's not killing Poppy.","occurrence_index":0},{"quote":"If Mel is showing on mid, this could be a good flip,","occurrence_index":0}]},{"extraction_text":"'She' in 'She's not on mid' refers to Mel.","resolution_status":"context_resolved","source_references":[{"quote":"She's not on mid, because wave equals ward.","occurrence_index":0},{"quote":"If Mel is showing on mid, this could be a good flip,","occurrence_index":0}]},{"extraction_text":"'you' in 'you don't play around waves being your ward' refers to the addressed player.","resolution_status":"context_resolved","source_references":[{"quote":"But you don't play around waves being your ward.","occurrence_index":0}]},{"extraction_text":"'your' in 'your ward' refers to the addressed player.","resolution_status":"context_resolved","source_references":[{"quote":"waves being your ward","occurrence_index":0}]},{"extraction_text":"'you' in 'you chase' refers to the addressed player.","resolution_status":"context_resolved","source_references":[{"quote":"So, you chase.","occurrence_index":0}]},{"extraction_text":"'this' in 'this could be a good flip' refers to the situation in which Mel is showing on mid.","resolution_status":"context_resolved","source_references":[{"quote":"If Mel is showing on mid, this could be a good flip,","occurrence_index":0}]}],"abilities_resources":[{"extraction_text":"ward (vision resource; the source says the wave can serve as your ward)","resolution_status":"context_resolved","source_references":[{"quote":"wave equals ward","occurrence_index":0},{"quote":"waves being your ward","occurrence_index":0}]}],"events_actions":[{"extraction_text":"Mel shows on mid (hypothetical/conditional)","resolution_status":"literal_explicit","source_references":[{"quote":"If Mel is showing on mid, this could be a good flip,","occurrence_index":0}]},{"extraction_text":"You chase","resolution_status":"literal_explicit","source_references":[{"quote":"But you don't play around waves being your ward. So, you chase.","occurrence_index":0}]},{"extraction_text":"She is not killing Poppy","resolution_status":"literal_explicit","source_references":[{"quote":"She's not a bot, because well, obviously, she's not killing Poppy.","occurrence_index":0}]},{"extraction_text":"You do not play around waves being your ward","resolution_status":"literal_explicit","source_references":[{"quote":"But you don't play around waves being your ward.","occurrence_index":0}]}],"states":[{"extraction_text":"Mel is not in bot lane","resolution_status":"context_resolved","source_references":[{"quote":"She's not a bot, because well, obviously, she's not killing Poppy.","occurrence_index":0}]},{"extraction_text":"Mel is not on mid","resolution_status":"literal_explicit","source_references":[{"quote":"She's not on mid, because wave equals ward.","occurrence_index":0}]},{"extraction_text":"The wave is treated as a ward (wave equals ward)","resolution_status":"literal_explicit","source_references":[{"quote":"wave equals ward","occurrence_index":0}]}],"conditions":[{"extraction_text":"If Mel is showing on mid, then this could be a good flip","resolution_status":"literal_explicit","source_references":[{"quote":"If Mel is showing on mid, this could be a good flip,","occurrence_index":0}]},{"extraction_text":"If you do not play around waves as your ward, then you chase","resolution_status":"context_resolved","source_references":[{"quote":"But you don't play around waves being your ward. So, you chase.","occurrence_index":0}]}],"recommended_advice":[{"extraction_text":"Play around waves being your ward","resolution_status":"context_resolved","source_references":[{"quote":"But you don't play around waves being your ward.","occurrence_index":0}]}],"consequences_outcomes":[{"extraction_text":"Chasing results from not playing around waves being your ward","resolution_status":"context_resolved","source_references":[{"quote":"But you don't play around waves being your ward. So, you chase.","occurrence_index":0}]},{"extraction_text":"If Mel is showing on mid, a good flip is possible","resolution_status":"literal_explicit","source_references":[{"quote":"If Mel is showing on mid, this could be a good flip,","occurrence_index":0}]},{"extraction_text":"Because Mel is not killing Poppy, she is concluded to be not in bot lane","resolution_status":"context_resolved","source_references":[{"quote":"She's not a bot, because well, obviously, she's not killing Poppy.","occurrence_index":0}]},{"extraction_text":"Because wave equals ward, Mel is concluded to be not on mid","resolution_status":"literal_explicit","source_references":[{"quote":"She's not on mid, because wave equals ward.","occurrence_index":0}]}],"explicit_relationships":[{"relation_type":"REFERS_TO","extraction_text":"'She' refers to Mel","resolution_status":"context_resolved","source_references":[{"quote":"She's not a bot, because well, obviously, she's not killing Poppy.","occurrence_index":0},{"quote":"If Mel is showing on mid, this could be a good flip,","occurrence_index":0}]},{"relation_type":"CAUSES","extraction_text":"Mel not killing Poppy is given as the reason Mel is not in bot lane","resolution_status":"context_resolved","source_references":[{"quote":"She's not a bot, because well, obviously, she's not killing Poppy.","occurrence_index":0}]},{"relation_type":"CAUSES","extraction_text":"Wave equals ward is given as the reason Mel is not on mid","resolution_status":"literal_explicit","source_references":[{"quote":"She's not on mid, because wave equals ward.","occurrence_index":0}]},{"relation_type":"CAUSES","extraction_text":"Not playing around waves as your ward leads to chasing","resolution_status":"literal_explicit","source_references":[{"quote":"But you don't play around waves being your ward. So, you chase.","occurrence_index":0}]},{"relation_type":"CONDITION","extraction_text":"Mel showing on mid is the condition for a good flip","resolution_status":"literal_explicit","source_references":[{"quote":"If Mel is showing on mid, this could be a good flip,","occurrence_index":0}]}],"uncertainty_unresolved":[{"extraction_text":"The logical connection between 'she's not killing Poppy' and 'She's not a bot' is not fully transparent; preserved literally without guessing.","resolution_status":"unresolved","source_references":[{"quote":"She's not a bot, because well, obviously, she's not killing Poppy.","occurrence_index":0}]}],"supporting_source_spans":[{"extraction_text":"Source spans covering the target passage","resolution_status":"literal_explicit","source_references":[{"quote":"then it's bot.","occurrence_index":0},{"quote":"She's not a bot, because well, obviously, she's not killing Poppy.","occurrence_index":0},{"quote":"She's not on mid, because wave equals ward.","occurrence_index":0},{"quote":"But you don't play around waves being your ward. So, you chase.","occurrence_index":0},{"quote":"If Mel is showing on mid, this could be a good flip,","occurrence_index":0}]}]}}